id,task,owner,status,priority,target_date,phase,category,notes,dependencies,verification
# ──────────────────────────────────────────────────────────────
OPS-001,Daily LinkedIn engagement (5–10 comments),Robert,not-started,P1,ongoing,Ops,LinkedIn,"Comment on compliance/property/finance/legal tech posts daily. Non-negotiable for organic reach.",—,"Daily habit"
OPS-002,Weekly production health check,engineering,not-started,P1,ongoing,Ops,Monitoring,"Check /api/health + Heroku logs + error tracking. 15-min weekly ritual.",—,"make heroku-logs"
OPS-003,Bi-weekly database backup verification,engineering,not-started,P1,ongoing,Ops,Database,"Verify Heroku automated backups running. Test restore quarterly.",HARD-008,"heroku pg:backups --app capecraft"
OPS-004,Monthly project plan review,Robert,not-started,P1,ongoing,Ops,Management,"Review this CSV. Update statuses. Adjust dates based on actuals. Document learnings.",—,"Updated CSV committed to repo"
OPS-005,Monthly cash flow tracking,Robert,not-started,P1,ongoing,Ops,Finance,"Track actual vs projected from CASH_FLOW_PROJECTION.md. Adjust forecasts.",—,"Spreadsheet updated"
